{
  "case_id": "daliResizeBilinear",
  "name": "DALI bilinear resize",
  "category": "ai",
  "source": {
    "type": "adapted",
    "url": "https://github.com/NVIDIA/DALI/blob/main/dali/operators/resize/resize.cu",
    "license": "Apache-2.0",
    "original_path": "original/main.cu"
  },
  "cuda_features": [
    "2D grid",
    "bilinear interpolation",
    "batched image indexing"
  ],
  "libraries": [],
  "input": {
    "type": "hashed",
    "sizes": [
      2,
      18,
      20,
      3,
      28,
      24
    ],
    "seed": 123
  },
  "build": {
    "cuda_build_command": "nvcc -O2 -std=c++17 original/main.cu -o original/build/app",
    "sycl_build_command": "icpx -fsycl -O2 -std=c++17 syclomatic/main.dp.cpp -o build_sycl/app"
  },
  "run": {
    "cuda_run_command": "original/build/app output/cuda_output.txt",
    "sycl_run_command": "build_sycl/app output/sycl_output.txt"
  },
  "correctness": {
    "method": "cpu_reference",
    "metric": "max_abs_error",
    "tolerance": 0.0001,
    "expected_pass_string": "PASS"
  },
  "syclomatic": {
    "status": "not_attempted",
    "command": "",
    "warnings_count": null,
    "manual_fixes_required": null
  },
  "status": {
    "cuda_compile": "not_attempted",
    "cuda_run": "not_attempted",
    "cuda_verify": "not_attempted",
    "syclomatic_migrate": "not_attempted",
    "sycl_compile": "not_attempted",
    "sycl_run": "not_attempted",
    "sycl_verify": "not_attempted"
  },
  "notes": "Standalone half-pixel bilinear resize benchmark adapted from DALI Resize's image resampling workload."
}
